Job Title,Salary Estimate,Job Description,Rating,Company Name,Location,Headquarters,Size,Founded,Type of ownership,Industry,Sector,Revenue,Competitors
Research Scientist,CA$90K-CA$113K (Glassdoor Est.),"Wenco International Mining Systems (www.wencomine.com), a subsidiary of Hitachi, is a software development and technology company that provides a series of technology product lines related to optimization and improvement of mines and material movers worldwide. Some of our products include:
GPS-based fleet management systems
Collision avoidance safety systems
Asset Health and predictive maintenance
Optimized Smart Dispatch
Autonomous trucks and specialized automation
Analytics and BI
As Wenco continues to build the next generation of technology, we need a wide range of professionals to help us achieve our objectives. We are currently looking for a full-time Research Scientist to join our head office in Richmond BC.
Reporting to the Principal Systems Engineer, the Research Scientist will join an Agile environment and be responsible for contributing towards the research and development of novel solutions and products in the area of inferential sensors, systems modeling and algorithm development. If you are an experienced, enthusiastic and motivated candidate looking to learn and progress your career, we want to hear from you!
Key Deliverables and Responsibilities:
Industrial quality code implementation for real-time inferential sensors and monitoring solutions.
Support and development of practical concepts, prototypes and methods in domain of:
Systems modeling, signal processing, design of experiment, systems identification, model validation, numerical methods, real-time algorithm design and development, inferential sensors.
Mathematical modeling of mechanical and hydraulics elements of heavy machinery.
Model-based inferential sensors and monitoring systems software solutions development.
Participation and regular communication in Agile environment.
Research and development in the specified domains and presentation of results.
Testing and solution refinement through the life-cycle of solution development.
Functional design, test and project documentation and reports.
Scientific publications, state of the art reviews, surveys and reports.
Process development for product configuration, calibration and use in real-world operation.
EXPERIENCE, KNOWLEDGE, SKILLS AND ABILITY REQUIRED:
Degree in engineering (mechanical, electrical, mechatronics, systems) with focus on control systems, signal processing theory and applications, mathematical modeling, robotics, systems identification or related fields. A graduate degree in engineering is preferred.
Candidates with Computing Science degree and experience with applications in industry, robotics or heavy machinery may be considered.
Minimum 5 years experience in areas of control, modeling, optimization, signal processing, data science, or systems identification, preferably with applications to industry, heavy machinery or complex operations or facilities.
Experience with Octave, C/C++, Visual Studio, Pyton, Matlab, Simulink, Simulink Coder
Mathematical modeling of mechanical, hydraulic or electromechanical systems, dynamics and kinematics of robotic systems, and development and implementation of related inferential senor algorithms and software solutions
Experience in working with real time embedded algorithms and systems
Experience with relational and non-relational databases, data acquisition, and handling of diverse data sources
Experience in system or software design and the development process
Skills and Abilities
Strong written and oral communication skills
Highly enthusiastic and effective collaborator in a team environment
Sharp analytical and problem-solving abilities
Strong presentation skills
Ability to innovate and implement novel concepts
WHY JOIN WENCO?
We provide opportunities for career-growth within a fast scaling company
We offer an extensive benefits plan, including a personal/health spending allowance
We provide a fun working environment, including Fresh Fruit Mondays and Popcorn Fridays, monthly employee engagement activities, and on-site games such as Ping-Pong, Foosball, Big Jenga and Connect 4
We offer opportunities for continuous training and professional development (in-house and external) to learn the latest technologies
We offer our employees a profit-sharing plan that provides them with the benefits of their hard work
We provide free parking and shuttle service for employees using transit
We are heavily involved in the community and join various events of non-profit organizations
We pride ourselves on our company culture (our last Employee Survey resulted in a score of 100% in inclusiveness and diversity)
We offer much more!
Wenco advances the efficiency and safety of the world’s surface mining equipment through our fleet management systems. We are committed to providing a stable yet exciting workplace environment for individual employees to build and grow their career with the Company.
Wenco is an Equal Opportunity Employer.
Disclaimer
The information in this description has been designed to indicate the general nature and level of work performed by employees. It is not designed to contain or be interpreted as a comprehensive inventory of all duties, responsibilities, and qualifications required of employees assigned to this job. It is not intended as an employment contract. Job descriptions are subject to change, which may not necessarily affect compensation.",4.2,"Wenco International Mining Systems
4.2",Richmond,"Richmond, Canada",51 to 200 employees,-1,Company - Private,Enterprise Software & Network Solutions,Information Technology,₹1 to ₹5 billion (INR),-1
Machine Learning Engineer,CA$90K-CA$113K (Glassdoor Est.),"Machine Learning Engineer - Intermediate, and Senior

Looking for an opportunity to join a great, local success story that hasn't given up the agility and energy of its start-up DNA? MavTek is the trailblazing Montreal-based technology company you haven't heard of until now. We're building the next generation of large-scale e-commerce and content delivery platforms, and yes, it's as much fun as it sounds!

The successful candidate will join the Machine Learning Engineer team.

As a passionate ML Engineer, you will design and build machine learning systems, tools, and validation strategies to support new machine learning applications. You should have a proven history of bringing machine learning initiatives into production, and in generating new ML ideas. You will have the ability to influence your peers and leadership can enable others to adopt your vision. As an ML Engineer, you will collaborate with other Machine Learning Engineers and Data Scientists.

Responsibilities:
Develop and deploy ML/DL models from raw data
Design ML/DL applications that demonstrate the technology's real-world potential
Use best SW Engineering methodologies to implement the applications
Deploy the applications on Cloud to release their full power
Drive your ML/DL projects from proposal to production
Technical Skills:
Good understanding of machine learning theory and mathematical modeling
Ability to develop machine learning models on large and complex data
Practical experience with ML/DL libraries, like Keras/TensorFlow, Torch, Scikit-learn
Intermediate/Advanced programming skills in Python (3+ years), or any other popular programming languages like Java or C++
Good knowledge in Database/Datawarehouse and proficiency in using SQL
Experience with Cloud Computing (1-2 years), like AWS, GCP, Azure
Knowledge in developing micro-service
Data driven mindset
Passionate to design high reliability & high-performance solutions
Personal Skills:
Ability to work both independently and as a member of a team
Good communication skills and initiative is a must
Self-driven individual and able to engage with different teams
Fast learner, high capacity for abstract thinking with hands-on mentality
Curious about new tech and advances in the industry, think further than the solution appears to require
Nice to Have:
Any AWS certificates
Experience in data processing, like using Spark or Flink for ETL jobs
Container experience, like Docker or Kubernates
Familiar with Linux systems and Shell programming
RESTful API and Webserver experience or knowledge
Knowledge in GPU computing
CI/CD knowledge or experience with Jenkins
Good knowledge in GIT
Agile experience
What We Offer:
A dynamic and collaborative environment
Competitive salaries
Catered breakfast and lunch prepared by in-house chef, as well as snacks, coffee and tea
Flex hours and summer hours
Onsite perks such as ping pong tables, PlayStation and more
Referral bonuses
The best corporate events in Montreal
Professional development training and opportunities
A team that has your back
Communicate ideas, updates, or issues to various stakeholders",4.6,"MavTek
4.6",Montreal,"Montreal, Canada",51 to 200 employees,2014,Company - Private,Internet,Information Technology,Unknown / Non-Applicable,"MindGeek, Shopify, Lightspeed"
Analytics Consultant,CA$90K-CA$113K (Glassdoor Est.),"Analytics Consultant

Carpedia Analytics is a growing function aimed at transforming raw data into unique insights that supports decision-making for our clients. The data analysis that the group does is designed to creativity solve real business challenges levering advanced analytics techniques. These tools and models support strategic and operating decisions across a wide-range of industries.

The Analytics Team supports the needs of our Project Teams who travel and interface with clients on a daily basis. The purpose of the group is to insource work from the Project Teams to maximize client interactions. The type of work insourced ranges from complex run models for manufacturing environments to the creation of Weekly Dashboard or Operating Reports. The team is critical in supporting the innovation within the organization.

The successful candidate will be able to think laterally and creativity through applying a quantitative mindset to solve unique operating problems and challenges. The candidate will need to have strong communication and time management skills due to competing priorities and teams. Strong, assertive, and concise communication with the other Project Teams is required to fully understand the scope of work as well as provide relevant and applicable client solutions.

Responsibilities
Work directly with clients and their IT teams to collect data, understand their IT infrastructure and reporting capabilities, and create project plans for model delivery
Manage client expectations around timelines and functionality
Work under time-sensitive situations, with opaque and diverse datasets
Creatively formulate statistical and quantitative approaches to analyze data and generate insights to provide high impact solutions for business challenges
Apply regression or analytic models to analyze value drivers such as service level, cost or inventory optimization
Provide meaningful insight on a wide range of industry and functional opportunities and themes such as linking operating and financial indicators with a complex array of models or datasets
Ability to articulate analytics findings in a compelling and insightful way – both from a visual and verbal perspective
Occasional travel is required when the business problem is highly complex, and an onsite presence is required to scope the deliverable and retrieve data
Requirements
Bachelor's Degree in Business Administration, Supply Chain, Operations Research, Industrial Engineering or related fields
At least 2 years of experience in consulting and/or leading and delivering operations improvement initiatives by applying strategic techniques (strategic thinking, hypothesis-based consulting, performance bench marking, etc.)
Exposure to advanced analytics techniques and tools
Knowledge of one or more of the following operations areas: planning and supply chain
Excellent communication skills both oral and written. Individuals must be fluent in English. French and/or Spanish is an asset.
Ability to travel up to 50% of the time across North America as required by project needs. All employees are required to have a valid passport and be eligible to qualify for a TN work visa under NAFTA (must be a Canadian, American or Mexican citizen).


Please note that Carpedia is dedicated to creating and maintaining a work environment that promotes respect, equality, diversity and dignity. We strive to eliminate employment barriers and encourage a workplace based on the principles that align with our company values and promote positive employee practices. Candidates requiring accommodation during any stage of our selection process should advise us of this; we will strive to work with individuals to find a suitable means to meet their needs.

Please visithttps://carpedia.com/careers/multi-industry/to apply!

While we appreciate the interest of all candidates, only those selected for an interview will be contacted.",4.4,"Carpedia International
4.4",Oakville,"Oakville, Canada",51 to 200 employees,1994,Company - Private,Consulting,Business Services,Unknown / Non-Applicable,"McKinsey & Company, Celerant Consulting, PVA Consulting Group"
Sr. Data Scientist - Application,CA$90K-CA$113K (Glassdoor Est.),"About Fusion Analytics


We believe in a future where analytics takes the lead role in steering organizations, and that Fusion is positioned as the leading consulting firm for this transformation. Founded in 2005, we are now 30 consultants and will be growing to 50 in the next 3 years. To make this happen we are looking for extremely smart people to join us. Our current client list is a who’s who of amazing companies, including Budweiser, Sobey's, Staples, IKEA, Walmart and Canadian Tire. We love what we do and know you will too.


What makes this role unique

You will become a master in data science, statistical modelling & analytics
Exposure to Canada’s largest and most successful companies
Opportunity for aggressive promotion as we build our team
Work with the smartest team of data scientists in the country
Contribution to company success is encouraged from day one
No politics and we work hard for everyone to succeed
Highly supportive work culture (learn more at
http://www.fusionanalytics.com/team.html
).
Team builders (e.g. BBQs, board game nights)
Equal opportunity employer


Examples of typical projects

Develop a complex analytical model to help a national home decor retailer optimize their business operation
Build an integrated media mix model for a $20 billion international retailer
Work with a major national retailer to develop a predictive model to measure, monitor and forecast key industry indicators


Requirements

A Masters or undergraduate degree with knowledge in data science (Mathematics, Statistics, Engineering, Finance, Science)
3+ years of professional experience related to data science, modelling and analytics
Strong technical skill in data modelling, machine / deep learning models (R, Python, Power Pivot, Power BI)
Strong sense of curiosity, with advanced critical thinking and analytical skills
Passionate about problem-solving and will rise to any challenge
Track record in doing excellent work in a high pressure and fast paced environment


Compensation

Competitive top-tier data scientist level salary
Health & dental benefits for spouse and dependents
Share options at the management level


Start Date

Flexible start dates through 2019 and 2020


Application Deadline

Ongoing


How to Apply

Apply with a PDF copy of your resume and undergraduate transcript.
Please name all files ((applicant name)) - ((document)) for example John Doe - Transcript.pdf.
Your resume should highlight your education, your overall GPA at each academic level, academic scholarships/awards, analytical experience (labeled as Analytical Experience), and other experience (labeled as Other Experience).
We define analytical experience in its broadest sense (working in a medical lab doing tests, software programming, robotic design, engineering projects, financial modeling, etc.).",4.8,"Fusion Analytics
4.8",Toronto,"Toronto, Canada",1 to 50 employees,2006,Company - Private,Consulting,Business Services,Unknown / Non-Applicable,-1
"Research Scientist, Data Visualization",CA$90K-CA$113K (Glassdoor Est.),"Location: Toronto- Canada
Job ID: 19WD36086

Research Team @ Autodesk
Autodesk Research is a team of expert scientists exploring and creating technologies to help improve design and its role in society through high-level customer projects, collaboration with leading research universities worldwide, and publications at world-renowned scientific venues.

Position Overview
The User Interface Research Group at Autodesk Research is seeking exceptionally talented research scientists to work on cutting-edge Human-Computer Interaction research on the topic of Data Visualization. This topic area could encompass research on many areas, including, but not limited to: developing interactive data visualizations; understanding and rendering high-dimensional data; developing immersive and 3D visualizations of data; simplifying and clarifying complex data and analyses; or the application of machine learning to any of the above areas. Successful candidates will have a demonstrated track record of broadly recognized research results in leading conferences and publication venues (e.g., ACM CHI, UIST, IEEE VIS or similar).

The overall mission of the User Interface Research Group is to apply Human-Computer Interaction expertise to develop fundamental understandings of how humans perceive, learn, and interact with technology, and based on these understandings, to develop novel interfaces and visualizationsto solve current problems, explore future opportunities, and influence Autodesk’s corporate strategy. A particular area of interest for our group is how the digital trails that humans leave as they interact with technology and the environment can be used to improve their future experiences.

Responsibilities
Conceive, plan, develop, and implement scientific research projects to advance scientific knowledge in business-relevant areas
Publish papers in peer-reviewed scientific journals/conferences
Supervise research interns (typically PhD students from top research universities)
Present research findings at conferences and participate in research collaborations with external research institutes and universities
Communicate and promote the use of research findings throughout Autodesk
Consult with product teams on the implementation of research findings into products
Generate intellectual property such as patents and trade-secrets from research findings
Manage and coordinate projects as they move from research prototype to shipping products or services
Minimum Qualifications
Ph.D. in Computer Science, Engineering, Mathematics or other relevant disciplines, ideally on the topic of Human-Computer Interaction or a closely-related area
Demonstrated experience of HCI research fundamentals, including experience designing and evaluating novel interfaces and technologies
Strong history of publications in HCI or related fields
Excellent written and oral communication skills
Ability to quickly learn new technologies and adapt to new situations
Ability to conduct quantitative and qualitative studies to evaluate concepts, designs, and systems
Ability to work collaboratively with people from many different disciplines (design, development, etc.)",3.6,"Autodesk
3.6",Toronto,"San Rafael, CA",5001 to 10000 employees,1982,Company - Public,Computer Hardware & Software,Information Technology,₹100 to ₹500 billion (INR),-1
